{
  "schema_name": "SourceRelationship",
  "schema_version": "1.0.0",
  "artifact_id": "brief-of-primary",
  "created_at": "2026-07-26T07:15:21Z",
  "created_by": {
    "actor_type": "host_agent",
    "host": "claude-code"
  },
  "source_document_id": "DOC-sha256-03abc1634d20ea28afd08aacca53013ccef4ab6a4482e9fcb25505fecff6458d",
  "related_document_id": "DOC-sha256-37de79c621d3efac6d05dea9154a92162429d5b26c83e145f60d055ec72359a5",
  "relationship_type": "republication",
  "confidence": "high",
  "detected_by": "metadata_identifier",
  "evidence_for_relationship": "The brief states it summarises the original study, repeats the identical 41 percent figure, and says it adds no new measurements.",
  "human_review_status": "not_required",
  "artifact_hash": "sha256:be1e3201b79a2c85bb0f9ebb1a52b8db8201175834a8470da3845193b2e654a7"
}
